{
  "id": "tier1-benefit-claim",
  "title": "Understanding a Benefit Claim Process",
  "tier": 1,
  "level_required": 1,
  "context": "You work as a Business Analyst for the Department for Work and Pensions (DWP). The team has drafted a BPMN diagram showing how a Universal Credit claim is processed from submission to payment. Review the diagram and answer the comprehension questions below.",
  "instructions": "Open the provided BPMN diagram and study the process flow. Answer the multiple-choice questions about the process structure, roles, and decision points.",
  "model_answer_file": "models/tier1-benefit-claim-answer.bpmn",
  "questions": [
    {
      "id": "q1",
      "type": "multiple_choice",
      "question": "How many lanes are in the pool?",
      "options": ["1", "2", "3", "4"],
      "correct_answer": "3",
      "points": 2
    },
    {
      "id": "q2",
      "type": "multiple_choice",
      "question": "What type of gateway is used for the eligibility decision?",
      "options": ["Parallel Gateway", "Exclusive Gateway", "Inclusive Gateway", "Event-Based Gateway"],
      "correct_answer": "Exclusive Gateway",
      "points": 2
    },
    {
      "id": "q3",
      "type": "multiple_choice",
      "question": "What happens when a claim is rejected at the eligibility check?",
      "options": ["The process ends immediately", "The claimant is notified and given an appeal option", "The claim is automatically approved", "The claim is sent to a manager"],
      "correct_answer": "The claimant is notified and given an appeal option",
      "points": 2
    },
    {
      "id": "q4",
      "type": "multiple_choice",
      "question": "Which element represents a regulatory control point in this process?",
      "options": ["Start Event", "Approval Notification Task", "Eligibility Check Gateway", "Process End"],
      "correct_answer": "Eligibility Check Gateway",
      "points": 2
    },
    {
      "id": "q5",
      "type": "multiple_choice",
      "question": "What is the purpose of the audit trail task in this process?",
      "options": ["To speed up the claim", "To record the decision for compliance purposes", "To notify the applicant", "To assign work to a case worker"],
      "correct_answer": "To record the decision for compliance purposes",
      "points": 2
    }
  ],
  "max_points": 10
}
